{
  "$schema": "https://json-schema.org/draft/2020-12/schema",
  "$id": "shieldkit-labs/p2/gate-b/gate-b1-role-unassigned-protocol-language/v1/root/v1",
  "type": "object",
  "additionalProperties": false,
  "required": [
    "schema",
    "artifactId",
    "status",
    "packageLifecycle",
    "sealed",
    "manifest",
    "packageIdentity",
    "laneBinding",
    "laneCredit",
    "gateEffect",
    "sourceBindings",
    "sourceAndAuthorityBoundary",
    "pendingSurfaceNames",
    "coreFieldSlots",
    "proofSessionSubroleBindings",
    "identityLayers",
    "genericShapes",
    "zeroCounts",
    "authorizations",
    "sourceCollision",
    "nonClaims"
  ],
  "properties": {
    "schema": {
      "const": "shieldkit-labs/p2/gate-b/gate-b1-role-unassigned-protocol-language/v1/root/v1"
    },
    "artifactId": {
      "const": null
    },
    "status": {
      "const": "DRAFT_ABSTRACT_ROLE_UNASSIGNED_PROSPECTIVE_UNRATIFIED_NO_CREDIT"
    },
    "packageLifecycle": {
      "const": "INTENTIONALLY_UNSEALED_DETACHED_NO_MANIFEST_NO_CHECKSUM_LIST"
    },
    "sealed": {
      "const": false
    },
    "manifest": {
      "const": null
    },
    "packageIdentity": {
      "const": null
    },
    "laneBinding": {
      "const": null
    },
    "laneCredit": {
      "const": "NONE"
    },
    "gateEffect": {
      "const": "NONE"
    },
    "sourceBindings": {
      "type": "object",
      "additionalProperties": false,
      "required": [
        "authorityDecision",
        "crossmapSnapshot"
      ],
      "properties": {
        "authorityDecision": {
          "type": "object",
          "additionalProperties": false,
          "required": [
            "locator",
            "bytes",
            "rawSha256",
            "schemaId",
            "artifactId",
            "status",
            "sealed",
            "decisionCoreDigest",
            "issuerDecisionDigest",
            "contentDigest"
          ],
          "properties": {
            "locator": {
              "const": "research-lanes/bch-shielded-pool-design/p2/gate-b/gate-b1-additive-language-authority-v1/root-sol-decision-record-v1.json"
            },
            "bytes": {
              "const": 15531
            },
            "rawSha256": {
              "const": "85061023cffe8a4cb2296bafe19c23ff7854583f5b9c6b4be21f0e2d4e896d66"
            },
            "schemaId": {
              "const": "shieldkit-labs/p2/gate-b/gate-b1-additive-language-authority/v1/root-sol-decision-record/v1"
            },
            "artifactId": {
              "const": "artifact:gate-b:gate-b1-additive-language-authority-v1:root-sol-decision-record-v1"
            },
            "status": {
              "const": "PROSPECTIVE_NEW_BASIS_STATIC_DETACHED_AUTHORING_SCOPE_ONLY_ROOT_SOL_APPROVED_UNSEALED_NO_CREDIT"
            },
            "sealed": {
              "const": false
            },
            "decisionCoreDigest": {
              "$ref": "digest.v1.schema.json#/$defs/decisionCoreDigest"
            },
            "issuerDecisionDigest": {
              "$ref": "digest.v1.schema.json#/$defs/issuerDecisionDigest"
            },
            "contentDigest": {
              "$ref": "digest.v1.schema.json#/$defs/contentDigest"
            }
          }
        },
        "crossmapSnapshot": {
          "type": "object",
          "additionalProperties": false,
          "required": [
            "locator",
            "bytes",
            "rawSha256",
            "schemaId",
            "artifactId",
            "status",
            "sealed",
            "snapshotDigest"
          ],
          "properties": {
            "locator": {
              "const": "research-lanes/bch-shielded-pool-design/p2/gate-b/gate-b1-additive-language-authority-v1/crossmap-snapshot-root.v1.json"
            },
            "bytes": {
              "const": 3742
            },
            "rawSha256": {
              "const": "d4e334aafd88fb2bf8638553748afb2a6d334a0c466a968f1dd3d2f854a202d0"
            },
            "schemaId": {
              "const": "shieldkit-labs/p2/gate-b/gate-b1-additive-language-authority/v1/crossmap-snapshot-root/v1"
            },
            "artifactId": {
              "const": "artifact:gate-b:gate-b1-additive-language-authority-v1:crossmap-snapshot-root-v1"
            },
            "status": {
              "const": "STATIC_DETACHED_UNSEALED_CROSSMAP_SNAPSHOT_NO_SOURCE_CLOSURE_NO_CREDIT"
            },
            "sealed": {
              "const": false
            },
            "snapshotDigest": {
              "$ref": "digest.v1.schema.json#/$defs/snapshotDigest"
            }
          }
        }
      }
    },
    "sourceAndAuthorityBoundary": {
      "const": {
        "legacyRaw": {
          "present": false,
          "sourceClosure": false
        },
        "retroactiveAuthenticationGranted": false,
        "missingLegacyRawCured": false,
        "protocolAuthorityGranted": false,
        "activeLanguageRatificationGranted": false,
        "authorRoleUnassignedLanguageDraft": true,
        "candidateAdmissionAllowed": false,
        "laneIntegrationAllowed": false,
        "refreezeAllowed": false,
        "executionAllowed": false
      }
    },
    "pendingSurfaceNames": {
      "const": [
        "protocolRoles",
        "embeddingGraph",
        "primitiveSuite",
        "circle",
        "air",
        "masking",
        "hashAndCommitment",
        "transcript",
        "samplers",
        "deep",
        "fri",
        "queries",
        "proofEncoding",
        "verifierTopology",
        "transactionEnvelope",
        "soundness",
        "privacy",
        "assumptionInventory"
      ]
    },
    "coreFieldSlots": {
      "type": "object",
      "additionalProperties": false,
      "required": [
        "fieldTower",
        "circleDomain",
        "embeddings",
        "hashSuite",
        "transcript",
        "masking",
        "air",
        "deep",
        "fri",
        "proofSession",
        "securityTargetId"
      ],
      "properties": {
        "fieldTower": {
          "$ref": "role-slot.v1.schema.json"
        },
        "circleDomain": {
          "$ref": "role-slot.v1.schema.json"
        },
        "embeddings": {
          "$ref": "role-slot.v1.schema.json"
        },
        "hashSuite": {
          "$ref": "role-slot.v1.schema.json"
        },
        "transcript": {
          "$ref": "role-slot.v1.schema.json"
        },
        "masking": {
          "$ref": "role-slot.v1.schema.json"
        },
        "air": {
          "$ref": "role-slot.v1.schema.json"
        },
        "deep": {
          "$ref": "role-slot.v1.schema.json"
        },
        "fri": {
          "$ref": "role-slot.v1.schema.json"
        },
        "proofSession": {
          "$ref": "role-slot.v1.schema.json"
        },
        "securityTargetId": {
          "$ref": "role-slot.v1.schema.json"
        }
      }
    },
    "proofSessionSubroleBindings": {
      "const": {
        "grammarId": null,
        "checkpointSemanticsId": null,
        "encodingId": null
      }
    },
    "identityLayers": {
      "type": "object",
      "additionalProperties": false,
      "required": [
        "primitiveTupleId",
        "candidateId",
        "proofProfileId",
        "deploymentProfileId"
      ],
      "properties": {
        "primitiveTupleId": {
          "$ref": "identity-layer.v1.schema.json"
        },
        "candidateId": {
          "$ref": "identity-layer.v1.schema.json"
        },
        "proofProfileId": {
          "$ref": "identity-layer.v1.schema.json"
        },
        "deploymentProfileId": {
          "$ref": "identity-layer.v1.schema.json"
        }
      }
    },
    "genericShapes": {
      "const": {
        "unassignedReference": {
          "schemaId": null,
          "artifactId": null,
          "locator": null,
          "rawSha256": null
        },
        "unassessedCompatibility": {
          "compatible": null,
          "reasonCodes": [],
          "evidenceRefs": []
        }
      }
    },
    "zeroCounts": {
      "const": {
        "activeLanguageCount": 0,
        "descriptorCount": 0,
        "candidateCount": 0,
        "tupleCount": 0,
        "roleAssignmentCount": 0,
        "parameterAssignmentCount": 0,
        "proofProfileCount": 0,
        "deploymentProfileCount": 0,
        "reviewInstanceCount": 0,
        "evidenceCount": 0,
        "measurementCount": 0,
        "executionCount": 0,
        "qualificationCount": 0,
        "rankingCount": 0,
        "selectionCount": 0
      }
    },
    "authorizations": {
      "const": {
        "activeLanguageRatificationAllowed": false,
        "descriptorCreationAllowed": false,
        "candidateCreationAllowed": false,
        "candidateAdmissionAllowed": false,
        "tupleCreationAllowed": false,
        "roleAssignmentAllowed": false,
        "parameterAssignmentAllowed": false,
        "profileInstantiationAllowed": false,
        "laneIntegrationAllowed": false,
        "gateReopenAllowed": false,
        "refreezeAllowed": false,
        "evidenceAdmissionAllowed": false,
        "measurementAllowed": false,
        "qualificationAllowed": false,
        "rankingAllowed": false,
        "selectionAllowed": false,
        "executionAllowed": false
      }
    },
    "sourceCollision": {
      "const": {
        "collisionId": "UOPC_EAC_FUTURE_PROVIDER_DAG_DIVERGENCE",
        "status": "UNRESOLVED_EXTERNAL_PRECEDENCE",
        "selectedDag": null,
        "selectedAPath": null,
        "packageMayInfer": false,
        "packageMaySelectSource": false,
        "admissionAllowed": false,
        "resolvedByThisDecision": false
      }
    },
    "nonClaims": {
      "const": [
        "NOT_LEGACY_SOURCE_CLOSURE",
        "NOT_RETROACTIVE_AUTHORITY",
        "NOT_ACTIVE_LANGUAGE_RATIFICATION",
        "NOT_A_PROTOCOL_DESCRIPTOR",
        "NOT_TYPED_DESCRIPTOR_V2",
        "NOT_PENDING_MARKER_RESOLUTION",
        "NOT_ROLE_ASSIGNMENT",
        "NOT_PARAMETER_ASSIGNMENT",
        "NOT_CANDIDATE_OR_TUPLE_CREATION",
        "NOT_GATE_REOPEN",
        "NOT_LANE_INTEGRATION",
        "NOT_REFREEZE_AUTHORITY",
        "NOT_SELECTION_AUTHORITY",
        "NOT_ADMISSION_AUTHORITY",
        "NOT_EXECUTION_AUTHORITY",
        "NOT_PRECEDENCE_COLLISION_RESOLUTION"
      ]
    }
  }
}
