{
  "schema": "shieldkit-labs/p2/gate-b/gate-b1-role-unassigned-protocol-language/v1/root/v1",
  "artifactId": null,
  "status": "DRAFT_ABSTRACT_ROLE_UNASSIGNED_PROSPECTIVE_UNRATIFIED_NO_CREDIT",
  "packageLifecycle": "INTENTIONALLY_UNSEALED_DETACHED_NO_MANIFEST_NO_CHECKSUM_LIST",
  "sealed": false,
  "manifest": null,
  "packageIdentity": null,
  "laneBinding": null,
  "laneCredit": "NONE",
  "gateEffect": "NONE",
  "sourceBindings": {
    "authorityDecision": {
      "locator": "research-lanes/bch-shielded-pool-design/p2/gate-b/gate-b1-additive-language-authority-v1/root-sol-decision-record-v1.json",
      "bytes": 15531,
      "rawSha256": "85061023cffe8a4cb2296bafe19c23ff7854583f5b9c6b4be21f0e2d4e896d66",
      "schemaId": "shieldkit-labs/p2/gate-b/gate-b1-additive-language-authority/v1/root-sol-decision-record/v1",
      "artifactId": "artifact:gate-b:gate-b1-additive-language-authority-v1:root-sol-decision-record-v1",
      "status": "PROSPECTIVE_NEW_BASIS_STATIC_DETACHED_AUTHORING_SCOPE_ONLY_ROOT_SOL_APPROVED_UNSEALED_NO_CREDIT",
      "sealed": false,
      "decisionCoreDigest": {
        "algorithm": "sha256",
        "canonicalization": "recursive-lexicographic-object-key-sort-arrays-preserve-order-json-utf8-lf-v1",
        "domain": "shieldkit-labs/p2/gate-b/gate-b1-additive-language-authority/v1/root-sol-decision-record/decision-core",
        "frame": "utf8(domain)||0x00||canonical-json-utf8||0x0a",
        "preimageKind": "EXACT_JSON_POINTER_VALUE",
        "jsonPointer": "/decisionCore",
        "excludedTopLevelKeys": [
          "schema",
          "artifactId",
          "status",
          "sealed",
          "decisionCoreDigest",
          "issuerDecision",
          "issuerDecisionDigest",
          "contentDigest"
        ],
        "value": "13044ec96d73322504c71205b97cdfeb09fdfed88763cfe3c2b2d88a5a2a6bda"
      },
      "issuerDecisionDigest": {
        "algorithm": "sha256",
        "canonicalization": "recursive-lexicographic-object-key-sort-arrays-preserve-order-json-utf8-lf-v1",
        "domain": "shieldkit-labs/p2/gate-b/gate-b1-additive-language-authority/v1/root-sol-decision-record/issuer-decision",
        "frame": "utf8(domain)||0x00||canonical-json-utf8||0x0a",
        "preimageKind": "EXACT_JSON_POINTER_VALUE",
        "jsonPointer": "/issuerDecision",
        "excludedTopLevelKeys": [
          "schema",
          "artifactId",
          "status",
          "sealed",
          "decisionCore",
          "decisionCoreDigest",
          "issuerDecisionDigest",
          "contentDigest"
        ],
        "value": "27f40fabf4d948c2333f053e21adb3b8dba606d98a1000091c746921f1e07057"
      },
      "contentDigest": {
        "algorithm": "sha256",
        "canonicalization": "recursive-lexicographic-object-key-sort-arrays-preserve-order-json-utf8-lf-v1",
        "domain": "shieldkit-labs/p2/gate-b/gate-b1-additive-language-authority/v1/root-sol-decision-record/record",
        "frame": "utf8(domain)||0x00||canonical-json-utf8||0x0a",
        "preimageKind": "TOP_LEVEL_OBJECT_WITH_EXCLUSIONS",
        "jsonPointer": "",
        "excludedTopLevelKeys": [
          "contentDigest"
        ],
        "value": "9f0ba4613351e004293aeb592b2141e5b4ebb58352e59f844bbf2ea50a0f30aa"
      }
    },
    "crossmapSnapshot": {
      "locator": "research-lanes/bch-shielded-pool-design/p2/gate-b/gate-b1-additive-language-authority-v1/crossmap-snapshot-root.v1.json",
      "bytes": 3742,
      "rawSha256": "d4e334aafd88fb2bf8638553748afb2a6d334a0c466a968f1dd3d2f854a202d0",
      "schemaId": "shieldkit-labs/p2/gate-b/gate-b1-additive-language-authority/v1/crossmap-snapshot-root/v1",
      "artifactId": "artifact:gate-b:gate-b1-additive-language-authority-v1:crossmap-snapshot-root-v1",
      "status": "STATIC_DETACHED_UNSEALED_CROSSMAP_SNAPSHOT_NO_SOURCE_CLOSURE_NO_CREDIT",
      "sealed": false,
      "snapshotDigest": {
        "algorithm": "sha256",
        "canonicalization": "recursive-lexicographic-object-key-sort-arrays-preserve-order-json-utf8-lf-v1",
        "domain": "shieldkit-labs/p2/gate-b/gate-b1-additive-language-authority/v1/crossmap-snapshot",
        "frame": "utf8(domain)||0x00||canonical-json-utf8||0x0a",
        "preimageKind": "EXACT_JSON_POINTER_VALUE",
        "jsonPointer": "/snapshotProjection",
        "excludedTopLevelKeys": [
          "schema",
          "artifactId",
          "status",
          "sealed",
          "packageLifecycle",
          "sourceClosure",
          "laneCredit",
          "gateEffect",
          "snapshotDigest",
          "legacyRaw",
          "sourceCollision",
          "nonClaims"
        ],
        "value": "4fab4fd9def866220d1f99b3339b9ca0567d5ac68e79bf80260a9ebb7202096f"
      }
    }
  },
  "sourceAndAuthorityBoundary": {
    "legacyRaw": {
      "present": false,
      "sourceClosure": false
    },
    "retroactiveAuthenticationGranted": false,
    "missingLegacyRawCured": false,
    "protocolAuthorityGranted": false,
    "activeLanguageRatificationGranted": false,
    "authorRoleUnassignedLanguageDraft": true,
    "candidateAdmissionAllowed": false,
    "laneIntegrationAllowed": false,
    "refreezeAllowed": false,
    "executionAllowed": false
  },
  "pendingSurfaceNames": [
    "protocolRoles",
    "embeddingGraph",
    "primitiveSuite",
    "circle",
    "air",
    "masking",
    "hashAndCommitment",
    "transcript",
    "samplers",
    "deep",
    "fri",
    "queries",
    "proofEncoding",
    "verifierTopology",
    "transactionEnvelope",
    "soundness",
    "privacy",
    "assumptionInventory"
  ],
  "coreFieldSlots": {
    "fieldTower": {
      "status": "UNASSIGNED",
      "value": null,
      "typeBinding": null,
      "sourceBinding": null
    },
    "circleDomain": {
      "status": "UNASSIGNED",
      "value": null,
      "typeBinding": null,
      "sourceBinding": null
    },
    "embeddings": {
      "status": "UNASSIGNED",
      "value": null,
      "typeBinding": null,
      "sourceBinding": null
    },
    "hashSuite": {
      "status": "UNASSIGNED",
      "value": null,
      "typeBinding": null,
      "sourceBinding": null
    },
    "transcript": {
      "status": "UNASSIGNED",
      "value": null,
      "typeBinding": null,
      "sourceBinding": null
    },
    "masking": {
      "status": "UNASSIGNED",
      "value": null,
      "typeBinding": null,
      "sourceBinding": null
    },
    "air": {
      "status": "UNASSIGNED",
      "value": null,
      "typeBinding": null,
      "sourceBinding": null
    },
    "deep": {
      "status": "UNASSIGNED",
      "value": null,
      "typeBinding": null,
      "sourceBinding": null
    },
    "fri": {
      "status": "UNASSIGNED",
      "value": null,
      "typeBinding": null,
      "sourceBinding": null
    },
    "proofSession": {
      "status": "UNASSIGNED",
      "value": null,
      "typeBinding": null,
      "sourceBinding": null
    },
    "securityTargetId": {
      "status": "UNASSIGNED",
      "value": null,
      "typeBinding": null,
      "sourceBinding": null
    }
  },
  "proofSessionSubroleBindings": {
    "grammarId": null,
    "checkpointSemanticsId": null,
    "encodingId": null
  },
  "identityLayers": {
    "primitiveTupleId": {
      "status": "UNINSTANTIATED",
      "identityValue": null,
      "preimageSchema": null,
      "digestAlgorithm": null,
      "instantiated": false,
      "excludedFields": [
        "evidence",
        "status"
      ]
    },
    "candidateId": {
      "status": "UNINSTANTIATED",
      "identityValue": null,
      "preimageSchema": null,
      "digestAlgorithm": null,
      "instantiated": false,
      "excludedFields": [
        "evidence",
        "status"
      ]
    },
    "proofProfileId": {
      "status": "UNINSTANTIATED",
      "identityValue": null,
      "preimageSchema": null,
      "digestAlgorithm": null,
      "instantiated": false,
      "excludedFields": [
        "evidence",
        "status"
      ]
    },
    "deploymentProfileId": {
      "status": "UNINSTANTIATED",
      "identityValue": null,
      "preimageSchema": null,
      "digestAlgorithm": null,
      "instantiated": false,
      "excludedFields": [
        "evidence",
        "status"
      ]
    }
  },
  "genericShapes": {
    "unassignedReference": {
      "schemaId": null,
      "artifactId": null,
      "locator": null,
      "rawSha256": null
    },
    "unassessedCompatibility": {
      "compatible": null,
      "reasonCodes": [],
      "evidenceRefs": []
    }
  },
  "zeroCounts": {
    "activeLanguageCount": 0,
    "descriptorCount": 0,
    "candidateCount": 0,
    "tupleCount": 0,
    "roleAssignmentCount": 0,
    "parameterAssignmentCount": 0,
    "proofProfileCount": 0,
    "deploymentProfileCount": 0,
    "reviewInstanceCount": 0,
    "evidenceCount": 0,
    "measurementCount": 0,
    "executionCount": 0,
    "qualificationCount": 0,
    "rankingCount": 0,
    "selectionCount": 0
  },
  "authorizations": {
    "activeLanguageRatificationAllowed": false,
    "descriptorCreationAllowed": false,
    "candidateCreationAllowed": false,
    "candidateAdmissionAllowed": false,
    "tupleCreationAllowed": false,
    "roleAssignmentAllowed": false,
    "parameterAssignmentAllowed": false,
    "profileInstantiationAllowed": false,
    "laneIntegrationAllowed": false,
    "gateReopenAllowed": false,
    "refreezeAllowed": false,
    "evidenceAdmissionAllowed": false,
    "measurementAllowed": false,
    "qualificationAllowed": false,
    "rankingAllowed": false,
    "selectionAllowed": false,
    "executionAllowed": false
  },
  "sourceCollision": {
    "collisionId": "UOPC_EAC_FUTURE_PROVIDER_DAG_DIVERGENCE",
    "status": "UNRESOLVED_EXTERNAL_PRECEDENCE",
    "selectedDag": null,
    "selectedAPath": null,
    "packageMayInfer": false,
    "packageMaySelectSource": false,
    "admissionAllowed": false,
    "resolvedByThisDecision": false
  },
  "nonClaims": [
    "NOT_LEGACY_SOURCE_CLOSURE",
    "NOT_RETROACTIVE_AUTHORITY",